<?xml version="1.0" encoding="utf-8"?>
<!ELEMENT GH5OGN_orarend (ora+)>
<!ATTLIST ora id ID #REQUIRED tipus (ElmÃ©let|Gyakorlat) #REQUIRED>

<!ELEMENT ora (targy, idopont, helyszin, oktato, szak)>
<!ELEMENT targy (#PCDATA)>
<!ELEMENT idopont (nap, tol, ig)>
<!ELEMENT nap (#PCDATA)>
<!ELEMENT tol (#PCDATA)>
<!ELEMENT ig (#PCDATA)>
<!ELEMENT helyszin (#PCDATA)>
<!ELEMENT oktato (#PCDATA)>
<!ELEMENT szak (#PCDATA)>


